{
  "$schema": "../component.schema.json",
  "selector": "good-inline-image",
  "className": "GoodInlineImageComponent",
  "kind": "component",
  "import": {
    "package": "@goodui/angular",
    "symbol": "GoodInlineImageComponent"
  },
  "source": "angular/projects/goodui/src/lib/typography.ts",
  "inputs": [
    {
      "name": "src",
      "type": "string",
      "required": true,
      "default": null,
      "allowedValues": null,
      "source": "angular/projects/goodui/src/lib/typography.ts",
      "kind": "input"
    },
    {
      "name": "alt",
      "type": "string",
      "required": true,
      "default": null,
      "allowedValues": null,
      "source": "angular/projects/goodui/src/lib/typography.ts",
      "kind": "input"
    },
    {
      "name": "caption",
      "type": "string",
      "required": false,
      "default": "",
      "allowedValues": null,
      "source": "angular/projects/goodui/src/lib/typography.ts",
      "kind": "input"
    },
    {
      "name": "align",
      "type": "GoodImageAlign",
      "required": false,
      "default": "center",
      "allowedValues": [
        "center",
        "left",
        "right"
      ],
      "source": "angular/projects/goodui/src/lib/typography.ts",
      "kind": "input"
    },
    {
      "name": "loading",
      "type": "\"lazy\" | \"eager\"",
      "required": false,
      "default": "lazy",
      "allowedValues": [
        "lazy",
        "eager"
      ],
      "source": "angular/projects/goodui/src/lib/typography.ts",
      "kind": "input"
    },
    {
      "name": "previewable",
      "type": "boolean",
      "required": false,
      "default": false,
      "allowedValues": null,
      "source": "angular/projects/goodui/src/lib/typography.ts",
      "kind": "input"
    }
  ],
  "outputs": [],
  "variants": {
    "align": [
      "center",
      "left",
      "right"
    ],
    "loading": [
      "lazy",
      "eager"
    ]
  },
  "composition": {
    "projectedContent": [],
    "relatedSelectors": [
      "good-image-preview"
    ],
    "notes": null
  },
  "forms": {
    "controlValueAccessor": false,
    "validator": false
  },
  "usageGuide": null,
  "usage": {
    "summary": null,
    "examples": []
  },
  "penpot": [
    {
      "penpotName": "goodui.image-caption",
      "penpotId": "c0c3286f-e4bf-804c-8008-d58ca0a60733",
      "kind": "internal-part",
      "state": null,
      "owner": "goodui.inline-image"
    },
    {
      "penpotName": "goodui.inline-image",
      "penpotId": "c0c3286f-e4bf-804c-8008-d58d2b885f78",
      "kind": "component",
      "state": null,
      "owner": null
    }
  ],
  "missing": {
    "usageGuide": true,
    "penpotMapping": false
  }
}
