{
  "$schema": "../component.schema.json",
  "selector": "good-prose",
  "className": "GoodProseComponent",
  "kind": "component",
  "import": {
    "package": "@goodui/angular",
    "symbol": "GoodProseComponent"
  },
  "source": "angular/projects/goodui/src/lib/typography.ts",
  "inputs": [],
  "outputs": [],
  "variants": {},
  "composition": {
    "projectedContent": [
      "*"
    ],
    "relatedSelectors": [],
    "notes": "See source template and component guide for projection slots."
  },
  "forms": {
    "controlValueAccessor": false,
    "validator": false
  },
  "usageGuide": null,
  "usage": {
    "summary": null,
    "examples": []
  },
  "penpot": [
    {
      "penpotName": "goodui.prose",
      "penpotId": "c0c3286f-e4bf-804c-8008-d58d0a7628e8",
      "kind": "component",
      "state": null,
      "owner": null
    }
  ],
  "missing": {
    "usageGuide": true,
    "penpotMapping": false
  }
}
