{
  "$schema": "../component.schema.json",
  "selector": "good-field-label",
  "className": "GoodFieldLabelComponent",
  "kind": "component",
  "import": {
    "package": "@goodui/angular",
    "symbol": "GoodFieldLabelComponent"
  },
  "source": "angular/projects/goodui/src/lib/typography.ts",
  "inputs": [
    {
      "name": "forId",
      "type": "string",
      "required": false,
      "default": "",
      "allowedValues": null,
      "source": "angular/projects/goodui/src/lib/typography.ts",
      "kind": "input"
    },
    {
      "name": "required",
      "type": "boolean",
      "required": false,
      "default": false,
      "allowedValues": null,
      "source": "angular/projects/goodui/src/lib/typography.ts",
      "kind": "input"
    }
  ],
  "outputs": [],
  "variants": {},
  "composition": {
    "projectedContent": [
      "*"
    ],
    "relatedSelectors": [],
    "notes": "See source template and component guide for projection slots."
  },
  "forms": {
    "controlValueAccessor": false,
    "validator": false
  },
  "usageGuide": null,
  "usage": {
    "summary": null,
    "examples": []
  },
  "penpot": [
    {
      "penpotName": "goodui.field-label",
      "penpotId": "c0c3286f-e4bf-804c-8008-d58ca0a37ad8",
      "kind": "component",
      "state": null,
      "owner": null
    }
  ],
  "missing": {
    "usageGuide": true,
    "penpotMapping": false
  }
}
