{
  "$schema": "../component.schema.json",
  "selector": "good-sidebar-submenu-item",
  "className": "GoodSidebarSubmenuItemComponent",
  "kind": "component",
  "import": {
    "package": "@goodui/angular",
    "symbol": "GoodSidebarSubmenuItemComponent"
  },
  "source": "angular/projects/goodui/src/lib/sidebar.ts",
  "inputs": [
    {
      "name": "item",
      "type": "GoodNavItem",
      "required": false,
      "default": null,
      "allowedValues": null,
      "source": "angular/projects/goodui/src/lib/sidebar.ts",
      "kind": "input"
    },
    {
      "name": "label",
      "type": "string",
      "required": false,
      "default": "",
      "allowedValues": null,
      "source": "angular/projects/goodui/src/lib/sidebar.ts",
      "kind": "input"
    },
    {
      "name": "route",
      "type": "string",
      "required": false,
      "default": {
        "expression": "undefined"
      },
      "allowedValues": null,
      "source": "angular/projects/goodui/src/lib/sidebar.ts",
      "kind": "input"
    },
    {
      "name": "active",
      "type": "boolean",
      "required": false,
      "default": false,
      "allowedValues": null,
      "source": "angular/projects/goodui/src/lib/sidebar.ts",
      "kind": "input"
    },
    {
      "name": "activeRoute",
      "type": "string",
      "required": false,
      "default": "",
      "allowedValues": null,
      "source": "angular/projects/goodui/src/lib/sidebar.ts",
      "kind": "input"
    }
  ],
  "outputs": [],
  "variants": {},
  "composition": {
    "projectedContent": [],
    "relatedSelectors": [],
    "notes": null
  },
  "forms": {
    "controlValueAccessor": false,
    "validator": false
  },
  "usageGuide": null,
  "usage": {
    "summary": null,
    "examples": []
  },
  "penpot": [
    {
      "penpotName": "goodui.sidebar-submenu-item.active",
      "penpotId": "521fe58c-da62-80e2-8008-d34536702092",
      "kind": "component",
      "state": "active",
      "owner": null
    },
    {
      "penpotName": "goodui.sidebar-submenu-item.default",
      "penpotId": "521fe58c-da62-80e2-8008-d34536320476",
      "kind": "component",
      "state": "default",
      "owner": null
    }
  ],
  "missing": {
    "usageGuide": true,
    "penpotMapping": false
  }
}
