{
  "$schema": "../component.schema.json",
  "selector": "good-card-footer",
  "className": "GoodCardFooterComponent",
  "kind": "component",
  "import": {
    "package": "@goodui/angular",
    "symbol": "GoodCardFooterComponent"
  },
  "source": "angular/projects/goodui/src/lib/card.ts",
  "inputs": [
    {
      "name": "align",
      "type": "\"start\" | \"end\" | \"between\"",
      "required": false,
      "default": "between",
      "allowedValues": [
        "start",
        "end",
        "between"
      ],
      "source": "angular/projects/goodui/src/lib/card.ts",
      "kind": "input"
    }
  ],
  "outputs": [],
  "variants": {
    "align": [
      "start",
      "end",
      "between"
    ]
  },
  "composition": {
    "projectedContent": [
      "*"
    ],
    "relatedSelectors": [],
    "notes": "See source template and component guide for projection slots."
  },
  "forms": {
    "controlValueAccessor": false,
    "validator": false
  },
  "usageGuide": null,
  "usage": {
    "summary": null,
    "examples": []
  },
  "penpot": [
    {
      "penpotName": "goodui.card-footer",
      "penpotId": "c0c3286f-e4bf-804c-8008-d52fe52ad872",
      "kind": "component",
      "state": null,
      "owner": null
    }
  ],
  "missing": {
    "usageGuide": true,
    "penpotMapping": false
  }
}
