{
  "$schema": "../component.schema.json",
  "selector": "good-subnav",
  "className": "GoodSubnavComponent",
  "kind": "component",
  "import": {
    "package": "@goodui/angular",
    "symbol": "GoodSubnavComponent"
  },
  "source": "angular/projects/goodui/src/lib/subnav.ts",
  "inputs": [
    {
      "name": "items",
      "type": "readonly GoodSubnavItem[]",
      "required": false,
      "default": [],
      "allowedValues": null,
      "source": "angular/projects/goodui/src/lib/subnav.ts",
      "kind": "input"
    },
    {
      "name": "actions",
      "type": "readonly GoodSubnavAction[]",
      "required": false,
      "default": [],
      "allowedValues": null,
      "source": "angular/projects/goodui/src/lib/subnav.ts",
      "kind": "input"
    },
    {
      "name": "ariaLabel",
      "type": "string",
      "required": false,
      "default": "Subnav",
      "allowedValues": null,
      "source": "angular/projects/goodui/src/lib/subnav.ts",
      "kind": "input"
    },
    {
      "name": "activeRoute",
      "type": "string",
      "required": false,
      "default": "",
      "allowedValues": null,
      "source": "angular/projects/goodui/src/lib/subnav.ts",
      "kind": "input"
    }
  ],
  "outputs": [],
  "variants": {},
  "composition": {
    "projectedContent": [
      "[good-subnav-actions]"
    ],
    "relatedSelectors": [
      "good-action-menu",
      "good-button"
    ],
    "notes": "See source template and component guide for projection slots."
  },
  "forms": {
    "controlValueAccessor": false,
    "validator": false
  },
  "usageGuide": "guides/components/subnav.md",
  "usage": {
    "summary": "`good-subnav` navigates between sections of one area, such as account pages. It is a 60 px strip on desktop and a 44 px strip on mobile. `good-main-view` can place it above the heading without extra layout CSS.",
    "examples": []
  },
  "penpot": [
    {
      "penpotName": "goodui.subnav-dropdown.default",
      "penpotId": "521fe58c-da62-80e2-8008-d40cd5f5d476",
      "kind": "internal-part",
      "state": "default",
      "owner": "goodui.subnav"
    },
    {
      "penpotName": "goodui.subnav-item.active",
      "penpotId": "521fe58c-da62-80e2-8008-d40ca32c96fa",
      "kind": "internal-part",
      "state": "active",
      "owner": "goodui.subnav"
    },
    {
      "penpotName": "goodui.subnav-item.link",
      "penpotId": "521fe58c-da62-80e2-8008-d40ca2339866",
      "kind": "internal-part",
      "state": "link",
      "owner": "goodui.subnav"
    },
    {
      "penpotName": "goodui.subnav-item.parent",
      "penpotId": "521fe58c-da62-80e2-8008-d40ca29a692f",
      "kind": "internal-part",
      "state": "parent",
      "owner": "goodui.subnav"
    },
    {
      "penpotName": "goodui.subnav.desktop",
      "penpotId": "521fe58c-da62-80e2-8008-d40cb8b8e01a",
      "kind": "component",
      "state": "desktop",
      "owner": null
    },
    {
      "penpotName": "goodui.subnav.menu-open",
      "penpotId": "521fe58c-da62-80e2-8008-d40cd63c49cf",
      "kind": "component",
      "state": "menu-open",
      "owner": null
    },
    {
      "penpotName": "goodui.subnav.mobile",
      "penpotId": "521fe58c-da62-80e2-8008-d40cba28bff7",
      "kind": "component",
      "state": "mobile",
      "owner": null
    },
    {
      "penpotName": "goodui.subnav.with-actions",
      "penpotId": "521fe58c-da62-80e2-8008-d41a1e574999",
      "kind": "component",
      "state": "with-actions",
      "owner": null
    }
  ],
  "missing": {
    "usageGuide": false,
    "penpotMapping": false
  }
}
