{
  "$schema": "../component.schema.json",
  "selector": "good-action-group",
  "className": "GoodActionGroupComponent",
  "kind": "component",
  "import": {
    "package": "@goodui/angular",
    "symbol": "GoodActionGroupComponent"
  },
  "source": "angular/projects/goodui/src/lib/action-group.ts",
  "inputs": [
    {
      "name": "orientation",
      "type": "GoodActionGroupOrientation",
      "required": false,
      "default": "horizontal",
      "allowedValues": [
        "vertical",
        "horizontal",
        "responsive"
      ],
      "source": "angular/projects/goodui/src/lib/action-group.ts",
      "kind": "input"
    },
    {
      "name": "spacing",
      "type": "GoodActionGroupSpacing",
      "required": false,
      "default": "default",
      "allowedValues": [
        "default",
        "small",
        "large"
      ],
      "source": "angular/projects/goodui/src/lib/action-group.ts",
      "kind": "input"
    },
    {
      "name": "justify",
      "type": "GoodActionGroupJustify",
      "required": false,
      "default": "start",
      "allowedValues": [
        "center",
        "start",
        "end",
        "between"
      ],
      "source": "angular/projects/goodui/src/lib/action-group.ts",
      "kind": "input"
    },
    {
      "name": "align",
      "type": "GoodActionGroupAlign",
      "required": false,
      "default": "start",
      "allowedValues": [
        "center",
        "start",
        "end",
        "stretch"
      ],
      "source": "angular/projects/goodui/src/lib/action-group.ts",
      "kind": "input"
    },
    {
      "name": "wrap",
      "type": "boolean",
      "required": false,
      "default": true,
      "allowedValues": null,
      "source": "angular/projects/goodui/src/lib/action-group.ts",
      "kind": "input"
    },
    {
      "name": "ariaLabel",
      "type": "string",
      "required": false,
      "default": "",
      "allowedValues": null,
      "source": "angular/projects/goodui/src/lib/action-group.ts",
      "kind": "input"
    }
  ],
  "outputs": [],
  "variants": {
    "orientation": [
      "vertical",
      "horizontal",
      "responsive"
    ],
    "spacing": [
      "default",
      "small",
      "large"
    ],
    "justify": [
      "center",
      "start",
      "end",
      "between"
    ],
    "align": [
      "center",
      "start",
      "end",
      "stretch"
    ]
  },
  "composition": {
    "projectedContent": [
      "*"
    ],
    "relatedSelectors": [],
    "notes": "See source template and component guide for projection slots."
  },
  "forms": {
    "controlValueAccessor": false,
    "validator": false
  },
  "usageGuide": "guides/components/action-group.md",
  "usage": {
    "summary": "`good-action-group` arranges related actions and owns the space between them. Put `good-button`, `good-dropdown`, links, or other controls inside it. Individual controls do not need external margins. Use `horizontal` for a wrapping row, `vertical` for a column, or `responsive` for a row that becomes a full-width column on narrow screens.",
    "examples": [
      "ai/examples/edit-form.html",
      "ai/examples/login.html",
      "ai/examples/settings.html"
    ]
  },
  "penpot": [
    {
      "penpotName": "goodui.action-group",
      "penpotId": "c0c3286f-e4bf-804c-8008-d561933711ad",
      "kind": "component",
      "state": null,
      "owner": null
    }
  ],
  "missing": {
    "usageGuide": false,
    "penpotMapping": false
  }
}
